{
  "schema_version": 1,
  "normalizer": "sl-eval-normalize@1",
  "source_format": "claude-stream-json",
  "input_sha256": "4d179cba7d7c8da08f4d946681d983259c318123135e4921fe083cc592323f9f",
  "trace_sha256": "4d179cba7d7c8da08f4d946681d983259c318123135e4921fe083cc592323f9f",
  "status": "completed",
  "catalog": {
    "status": "beobachtet",
    "skills": [
      "evaluating-changes",
      "grilling",
      "planning-work-packages",
      "researching-repositories",
      "resuming-work",
      "reviewing-decision-gates",
      "specifying-behavior",
      "testing-system-boundaries",
      "deep-research",
      "design",
      "design-sync",
      "dataviz",
      "update-config",
      "verify",
      "debug",
      "code-review",
      "simplify",
      "batch",
      "fewer-permission-prompts",
      "doctor",
      "loop",
      "schedule",
      "send-to-project",
      "claude-api",
      "workflow-authoring",
      "run",
      "run-skill-generator",
      "plugin-authoring"
    ]
  },
  "tools": [
    "Edit",
    "Glob",
    "Grep",
    "Read",
    "Skill",
    "Write"
  ],
  "plugins": [
    {
      "name": "cc-plugin-agents-md",
      "source": "cc-plugin-agents-md@builtin"
    },
    {
      "name": "cc-plugin-telemetry",
      "source": "cc-plugin-telemetry@builtin"
    },
    {
      "name": "cc-plugin-plugin-authoring",
      "source": "cc-plugin-plugin-authoring@builtin"
    }
  ],
  "model": "claude-opus-5-5",
  "activations": [
    {
      "mode": "skill_tool",
      "skill": "grilling",
      "tool_use_id": "toolu_0176RSumhThhg9WPuy4KytBZ",
      "confirmed": true
    }
  ],
  "activation_observability": "events_observed",
  "absence_is_proven": false,
  "usage": {
    "input_tokens": 8,
    "output_tokens": 2832,
    "cache_read_input_tokens": 46327,
    "cache_creation_input_tokens": 14188
  },
  "client_cost_estimate_usd": 0.1794414,
  "quality_scored": false
}
