{
  "schema_version": 1,
  "normalizer": "sl-eval-normalize@1",
  "source_format": "claude-stream-json",
  "input_sha256": "e4901ed89ddba169a76670d0b0792d659b7744cf20c8f1eebe0ab2f52119fa47",
  "trace_sha256": "e4901ed89ddba169a76670d0b0792d659b7744cf20c8f1eebe0ab2f52119fa47",
  "status": "completed",
  "catalog": {
    "status": "beobachtet",
    "skills": [
      "evaluating-changes",
      "grilling",
      "planning-work-packages",
      "researching-repositories",
      "resuming-work",
      "reviewing-decision-gates",
      "specifying-behavior",
      "testing-system-boundaries",
      "deep-research",
      "design",
      "design-sync",
      "dataviz",
      "update-config",
      "verify",
      "debug",
      "code-review",
      "simplify",
      "batch",
      "fewer-permission-prompts",
      "doctor",
      "loop",
      "schedule",
      "send-to-project",
      "claude-api",
      "workflow-authoring",
      "run",
      "run-skill-generator",
      "plugin-authoring"
    ]
  },
  "tools": [
    "Glob",
    "Grep",
    "Read",
    "Skill"
  ],
  "plugins": [
    {
      "name": "cc-plugin-agents-md",
      "source": "cc-plugin-agents-md@builtin"
    },
    {
      "name": "cc-plugin-telemetry",
      "source": "cc-plugin-telemetry@builtin"
    },
    {
      "name": "cc-plugin-plugin-authoring",
      "source": "cc-plugin-plugin-authoring@builtin"
    }
  ],
  "model": "claude-opus-5-5",
  "activations": [
    {
      "mode": "skill_tool",
      "skill": "researching-repositories",
      "tool_use_id": "toolu_01V5SL6YdWi1jVQrYrEaweJs",
      "confirmed": true
    }
  ],
  "activation_observability": "events_observed",
  "absence_is_proven": false,
  "usage": {
    "input_tokens": 8,
    "output_tokens": 5615,
    "cache_read_input_tokens": 43230,
    "cache_creation_input_tokens": 13945
  },
  "client_cost_estimate_usd": 0.232538,
  "cost_balance": {
    "method": "sl-eval-cost-balance@1",
    "turns": [
      {
        "turn": 1,
        "usage": {
          "input_tokens": 2,
          "output_tokens": 16,
          "cache_read_input_tokens": 3846,
          "cache_creation_input_tokens": 7449
        }
      },
      {
        "turn": 2,
        "usage": {
          "input_tokens": 2,
          "output_tokens": 16,
          "cache_read_input_tokens": 11295,
          "cache_creation_input_tokens": 1352
        }
      },
      {
        "turn": 3,
        "usage": {
          "input_tokens": 2,
          "output_tokens": 16,
          "cache_read_input_tokens": 12647,
          "cache_creation_input_tokens": 2795
        }
      },
      {
        "turn": 4,
        "usage": {
          "input_tokens": 2,
          "output_tokens": 5,
          "cache_read_input_tokens": 15442,
          "cache_creation_input_tokens": 2349
        }
      }
    ],
    "turn_usage_sum": {
      "input_tokens": 8,
      "output_tokens": 53,
      "cache_read_input_tokens": 43230,
      "cache_creation_input_tokens": 13945
    },
    "usage_remainder": {
      "input_tokens": 0,
      "output_tokens": 5562,
      "cache_read_input_tokens": 0,
      "cache_creation_input_tokens": 0
    },
    "classes": [
      {
        "class": "assistant_denken",
        "blocks": 1,
        "bytes": 0,
        "bytes_x_later_turns": 0
      },
      {
        "class": "assistant_text",
        "blocks": 1,
        "bytes": 7273,
        "bytes_x_later_turns": 0
      },
      {
        "class": "assistant_werkzeugaufruf",
        "blocks": 9,
        "bytes": 991,
        "bytes_x_later_turns": 1081
      },
      {
        "class": "datei_lesen",
        "blocks": 7,
        "bytes": 2454,
        "bytes_x_later_turns": 2454
      },
      {
        "class": "skill_laden",
        "blocks": 2,
        "bytes": 2571,
        "bytes_x_later_turns": 7713
      },
      {
        "class": "tool_ergebnis:Glob",
        "blocks": 1,
        "bytes": 4808,
        "bytes_x_later_turns": 9616
      }
    ],
    "bytes_total": 18097,
    "bytes_x_later_turns_total": 20864
  },
  "quality_scored": false
}
